{
  "$schema": "https://json-schema.org/draft/2020-12/schema",
  "$id": "https://github.com/OTL/microduck_rl/qdd_biped/skill_spec.schema.json",
  "title": "QDD biped skill spec (schema_version 2; 1 still accepted)",
  "description": "A short whole-body skill that starts and ends in the standing pose. Schema 2 adds jumps (contact schedule with flight phases, flight limits, pchip interpolation, policy rate). Structural schema only: tasks/qdd_skill.py validate_spec is the authoritative gate (it also checks timing, the pose-dependent knee limit, joint / torso speeds, torso tilt and height, flat parallel soles and static balance). Safety limits, terminations, observations, actions and domain randomisation are fixed by the task template and cannot be set here.",
  "type": "object",
  "additionalProperties": false,
  "required": [
    "schema_version",
    "name",
    "duration_s",
    "keyframes"
  ],
  "properties": {
    "schema_version": {
      "enum": [
        1,
        2
      ],
      "description": "2 = current (contact / flight / policy_rate_hz / pchip); 1 = no flight, 50 Hz"
    },
    "name": {
      "type": "string",
      "pattern": "^[a-z][a-z0-9_]{0,31}$"
    },
    "description": {
      "type": "string",
      "maxLength": 500
    },
    "duration_s": {
      "type": "number",
      "minimum": 1.0,
      "maximum": 8.0,
      "description": "Length of the motion; the last keyframe is at t = duration_s."
    },
    "settle_s": {
      "type": "number",
      "minimum": 0.5,
      "maximum": 3.0,
      "default": 1.0,
      "description": "Return-to-stand phase after the motion: the standing pose is held and rewarded."
    },
    "interpolation": {
      "enum": [
        "minjerk",
        "linear",
        "pchip"
      ],
      "default": "minjerk",
      "description": "minjerk = smooth, zero velocity at every keyframe; pchip (schema 2) = monotone cubic, velocity continues through monotone runs (push-off)."
    },
    "support": {
      "enum": [
        "both_feet"
      ],
      "default": "both_feet",
      "description": "both_feet: both soles stay flat on the floor the whole time."
    },
    "keyframes": {
      "type": "array",
      "minItems": 2,
      "maxItems": 16,
      "description": "Times strictly increasing, >= 0.2 s apart; first at t = 0 and last at t = duration_s, both the standing pose (no joints_deg / torso).",
      "items": {
        "$ref": "#/$defs/keyframe"
      }
    },
    "reward_weights": {
      "type": "object",
      "additionalProperties": false,
      "description": "Optional; penalties are magnitudes (applied negative). Defaults in tasks/qdd_skill.py REWARD_WEIGHT_BOUNDS. flight_* / landing_load / toe_first / takeoff_speed / joint_power apply to skills with a flight phase only; feet_contact then weights the contact schedule.",
      "properties": {
        "joint_tracking": {
          "type": "number",
          "minimum": 0.0,
          "maximum": 6.0,
          "default": 3.0
        },
        "torso_orientation": {
          "type": "number",
          "minimum": 0.0,
          "maximum": 6.0,
          "default": 2.0
        },
        "torso_height": {
          "type": "number",
          "minimum": 0.0,
          "maximum": 3.0,
          "default": 1.0
        },
        "balance": {
          "type": "number",
          "minimum": 0.5,
          "maximum": 3.0,
          "default": 1.0
        },
        "feet_contact": {
          "type": "number",
          "minimum": 0.5,
          "maximum": 3.0,
          "default": 1.0
        },
        "final_stand": {
          "type": "number",
          "minimum": 0.5,
          "maximum": 5.0,
          "default": 2.0
        },
        "action_rate": {
          "type": "number",
          "minimum": 0.02,
          "maximum": 0.5,
          "default": 0.1
        },
        "joint_torques": {
          "type": "number",
          "minimum": 5e-05,
          "maximum": 0.001,
          "default": 0.0002
        },
        "foot_slip": {
          "type": "number",
          "minimum": 0.5,
          "maximum": 3.0,
          "default": 1.0
        },
        "flight_height": {
          "type": "number",
          "minimum": 0.5,
          "maximum": 6.0,
          "default": 3.0
        },
        "flight_rotation": {
          "type": "number",
          "minimum": 0.1,
          "maximum": 2.0,
          "default": 0.5
        },
        "landing_load": {
          "type": "number",
          "minimum": 0.5,
          "maximum": 5.0,
          "default": 1.0
        },
        "toe_first": {
          "type": "number",
          "minimum": 0.0,
          "maximum": 2.0,
          "default": 0.5
        },
        "takeoff_speed": {
          "type": "number",
          "minimum": 1.0,
          "maximum": 20.0,
          "default": 10.0
        },
        "joint_power": {
          "type": "number",
          "minimum": 0.0,
          "maximum": 0.005,
          "default": 0.001
        },
        "foot_clearance": {
          "type": "number",
          "minimum": 0.0,
          "maximum": 10.0,
          "default": 0.0,
          "description": "feed-forward jumps with a planned foot clearance (reference table foot_clear_m): lowest sole point above the floor while airborne"
        }
      }
    },
    "policy_rate_hz": {
      "enum": [
        50,
        100
      ],
      "default": 50,
      "description": "Schema 2: policy rate of this skill (the ONNX policy_io states policy_dt_s; the controller runs the skill at this rate)."
    },
    "reference_table": {
      "type": "string",
      "pattern": "^[a-z][a-z0-9_]{0,40}\\.json$",
      "description": "Schema 2: feed-forward reference table in skills/ (written by a tool such as the robot repo's analysis/hop_reference.py, never by hand): joint position / velocity targets, torque feed-forward and residual scale every dt. The low level plays it back and the policy learns a residual around it."
    },
    "contact": {
      "type": "array",
      "minItems": 1,
      "maxItems": 7,
      "description": "Schema 2 contact schedule: phases {t, feet} from t = 0 ('both'), alternating 'both' / 'none' (flight), ending 'both'. Each flight 0.06..0.3 s and close to the ballistic time of flight.com_rise_m; take-off >= 0.5 s; last touchdown >= 0.5 s before duration_s. Around a flight (take-off - 0.15 s .. touchdown + 0.25 s) joints may move up to 20 rad/s, keyframes may be 0.02 s apart and the flat-sole checks are skipped in the air and landing window; torso pitch limit 40 deg.",
      "items": {
        "type": "object",
        "additionalProperties": false,
        "required": [
          "t",
          "feet"
        ],
        "properties": {
          "t": {
            "type": "number",
            "minimum": 0.0,
            "maximum": 8.0
          },
          "feet": {
            "enum": [
              "both",
              "none"
            ]
          }
        }
      }
    },
    "flight": {
      "type": "object",
      "additionalProperties": false,
      "required": [
        "com_rise_m"
      ],
      "description": "Schema 2, required iff the contact schedule has a flight: target and limits of the jump (robot repo docs/jump-feasibility.md).",
      "properties": {
        "com_rise_m": {
          "type": "number",
          "minimum": 0.005,
          "maximum": 0.04,
          "description": "Target CoM rise above the take-off height [m] (take-off speed sqrt(2 g h))."
        },
        "max_takeoff_speed_mps": {
          "type": "number",
          "minimum": 0.3,
          "maximum": 0.9,
          "default": 0.85,
          "description": "CoM vertical speed limit (motor bus current / LM5069)."
        },
        "max_landing_load_mg": {
          "type": "number",
          "minimum": 2.0,
          "maximum": 4.5,
          "default": 4.0,
          "description": "Landing load per foot [m g] above which the landing cost is strong (ankle motor radial limit 4.7 m g)."
        },
        "toe_first": {
          "type": "boolean",
          "default": true,
          "description": "Reward touching down toes first (ankle plantar-flexed)."
        }
      }
    }
  },
  "$defs": {
    "keyframe": {
      "type": "object",
      "additionalProperties": false,
      "required": [
        "t"
      ],
      "properties": {
        "t": {
          "type": "number",
          "minimum": 0.0,
          "maximum": 8.0,
          "description": "Seconds; >= 0.2 s after the previous keyframe (0.02 s around a flight)."
        },
        "joints_deg": {
          "$ref": "#/$defs/joints_deg"
        },
        "torso": {
          "type": "object",
          "additionalProperties": false,
          "description": "Optional cross-check of the pose the joints give with flat soles (pitch + = nose down, roll + = left side up, height of the torso origin above the floor; standing = 0, 0, 0.354). Not allowed in a flight / landing window. Pitch up to 30 deg (40 deg for a skill with flight).",
          "properties": {
            "pitch_deg": {
              "type": "number",
              "minimum": -15.0,
              "maximum": 40.0
            },
            "roll_deg": {
              "type": "number",
              "minimum": -10.0,
              "maximum": 10.0
            },
            "height_m": {
              "type": "number",
              "minimum": 0.24,
              "maximum": 0.4
            }
          }
        },
        "note": {
          "type": "string",
          "maxLength": 200
        }
      }
    },
    "joints_deg": {
      "type": "object",
      "additionalProperties": false,
      "description": "Absolute joint angles in degrees; unlisted joints keep the standing value (hip_pitch -22.5, knee 45, ankle_pitch -22.5, others 0). A side-less name sets both legs mirror-symmetrically (yaw / roll negate on the right leg). Ranges are the joint ranges minus 3 deg.",
      "properties": {
        "hip_yaw": {
          "type": "number",
          "minimum": -27.0,
          "maximum": 27.0
        },
        "hip_roll": {
          "type": "number",
          "minimum": -22.0,
          "maximum": 17.0
        },
        "hip_pitch": {
          "type": "number",
          "minimum": -97.0,
          "maximum": 37.0
        },
        "knee": {
          "type": "number",
          "minimum": 0.0,
          "maximum": 117.0
        },
        "ankle_pitch": {
          "type": "number",
          "minimum": -47.0,
          "maximum": 47.0
        },
        "l_hip_yaw": {
          "type": "number",
          "minimum": -27.0,
          "maximum": 27.0
        },
        "l_hip_roll": {
          "type": "number",
          "minimum": -22.0,
          "maximum": 17.0
        },
        "l_hip_pitch": {
          "type": "number",
          "minimum": -97.0,
          "maximum": 37.0
        },
        "l_knee": {
          "type": "number",
          "minimum": 0.0,
          "maximum": 117.0
        },
        "l_ankle_pitch": {
          "type": "number",
          "minimum": -47.0,
          "maximum": 47.0
        },
        "r_hip_yaw": {
          "type": "number",
          "minimum": -27.0,
          "maximum": 27.0
        },
        "r_hip_roll": {
          "type": "number",
          "minimum": -17.0,
          "maximum": 22.0
        },
        "r_hip_pitch": {
          "type": "number",
          "minimum": -97.0,
          "maximum": 37.0
        },
        "r_knee": {
          "type": "number",
          "minimum": 0.0,
          "maximum": 117.0
        },
        "r_ankle_pitch": {
          "type": "number",
          "minimum": -47.0,
          "maximum": 47.0
        }
      }
    }
  }
}
