{
 "schema_version": 2,
 "name": "hop",
 "description": "両足ジャンプ（足を高く）: 膝105度・胴体32度前傾でしゃがみ、重心が足の上・角運動量0のまま押し出して重心を約3.8cm上げる（離陸0.86m/s）。空中で膝を80度まで畳み、足裏を約8cm浮かせ、着地の前に脚を伸ばしてつま先を20度下げて着地し、膝90度まで沈んで受けて立ち姿勢に戻る。関節の目標・速さ・トルクのフィードフォワードは reference_table（robot repo の analysis/hop_reference.py）。方策はその補正だけを学ぶ。（足首 GIM6010-8 の案 D 用：D のモデルで作り、胴の前傾を変えて押し出しの胴の回転を 6 rad/s 以内にし、空中の膝を上限の 3.5 度手前・足首を 46.5 度・フィードフォワードを 8.7Nm で切った）",
 "duration_s": 2.6,
 "settle_s": 0.8,
 "interpolation": "pchip",
 "policy_rate_hz": 100,
 "support": "both_feet",
 "reference_table": "hop_ankle6010_ref.json",
 "contact": [
  {
   "t": 0.0,
   "feet": "both"
  },
  {
   "t": 1.286,
   "feet": "none"
  },
  {
   "t": 1.462,
   "feet": "both"
  }
 ],
 "flight": {
  "com_rise_m": 0.038,
  "max_takeoff_speed_mps": 0.9,
  "max_landing_load_mg": 4.0,
  "toe_first": true
 },
 "keyframes": [
  {
   "t": 0.0,
   "note": "standing"
  },
  {
   "t": 1.0,
   "joints_deg": {
    "hip_pitch": -96.9,
    "knee": 105.0,
    "ankle_pitch": -40.1
   },
   "note": "crouch: knee 105 deg, torso 32 deg forward, CoM over the feet (analysis/hop.py)"
  },
  {
   "t": 1.2,
   "joints_deg": {
    "hip_pitch": -96.9,
    "knee": 105.0,
    "ankle_pitch": -40.1
   },
   "note": "hold, then push (time-optimal push of analysis/hop.py)"
  },
  {
   "t": 1.286,
   "joints_deg": {
    "hip_pitch": -50.1,
    "knee": 64.0,
    "ankle_pitch": -29.2
   },
   "note": "take-off: knee 63 deg, CoM 0.86 m/s up, torso 15 deg (zero angular momentum)"
  },
  {
   "t": 1.376,
   "joints_deg": {
    "hip_pitch": -57.8,
    "knee": 106.5,
    "ankle_pitch": -46.5
   },
   "note": "apex: knee 80 deg, hips 0 deg flexed, soles 7.8 cm up"
  },
  {
   "t": 1.462,
   "joints_deg": {
    "hip_pitch": -54.9,
    "knee": 80.0,
    "ankle_pitch": -20.0
   },
   "note": "touchdown toes first (20 deg), knee 80 deg"
  },
  {
   "t": 1.712,
   "joints_deg": {
    "hip_pitch": -59.5,
    "knee": 89.6,
    "ankle_pitch": -44.8
   },
   "note": "absorbed (knee 90 deg), torso coming upright"
  },
  {
   "t": 2.6,
   "note": "standing again"
  }
 ],
 "reward_weights": {
  "joint_tracking": 2.0,
  "torso_orientation": 1.5,
  "feet_contact": 2.0,
  "flight_height": 2.0,
  "landing_load": 1.0,
  "foot_clearance": 5.0
 }
}